id,created_utc,title,selftext,full_link
rawtdz,1638875454,Want to increase passive income?,[removed],https://www.reddit.com/r/CryptoCurrency/comments/rawtdz/want_to_increase_passive_income/
rawtdm,1638875453,I don't really have friends into crypto and getting into hi was hard af for me so i thought I'll try to help someone that is in the same position as i was,,https://www.reddit.com/r/CryptoCurrency/comments/rawtdm/i_dont_really_have_friends_into_crypto_and/
rawt4g,1638875427,Nitro Network on Twitter,,https://www.reddit.com/r/CryptoCurrency/comments/rawt4g/nitro_network_on_twitter/
rawsyh,1638875409,IDEX Token Skyrockets 60% Following Coinbase Listing,,https://www.reddit.com/r/CryptoCurrency/comments/rawsyh/idex_token_skyrockets_60_following_coinbase/
rawqx0,1638875191,Billion users club- we’re still in the early days,"Personally I think it’s still early days for cryptocurrency still with only 300 million users (https://triple-a.io/crypto-ownership/) \n\nOnce we reach closer to billion users club I think the network effect will really start to take effect. \n\nLikely at 800 million we will already start to see people fomo-ing in like how the last 10% off nft projects just fly off the shelves. \n\nWhat are the predictions from the group when this would happen? Given the decentralised nature, 15 years would be fast? \n\nThe other technological adoptions have so far been centralised endeavours (https://www.visualcapitalist.com/rising-speed-technological-adoption/)",https://www.reddit.com/r/CryptoCurrency/comments/rawqx0/billion_users_club_were_still_in_the_early_days/
rawq9o,1638875123,NFT,,https://www.reddit.com/r/CryptoCurrency/comments/rawq9o/nft/
rawq4o,1638875109,Ledger key question,[removed],https://www.reddit.com/r/CryptoCurrency/comments/rawq4o/ledger_key_question/
rawq2i,1638875103,I tried to buy 200 USDT on Gate.IO using Banxa and I received a message that I would receive 188 USDT. I thought USDT was pegged to US dollar? Why the difference of 12 USD?,[removed],https://www.reddit.com/r/CryptoCurrency/comments/rawq2i/i_tried_to_buy_200_usdt_on_gateio_using_banxa_and/
rawpk1,1638875046,Nasdaq Stockholm lists Bitcoin and Ether exchange-traded notes,,https://www.reddit.com/r/CryptoCurrency/comments/rawpk1/nasdaq_stockholm_lists_bitcoin_and_ether/
rawns1,1638874868,"Mana coin price prediction 07 Dec 2021,Crypto Shakeel,mana decentraland today latest news &amp; forecast",,https://www.reddit.com/r/CryptoCurrency/comments/rawns1/mana_coin_price_prediction_07_dec_2021crypto/
rawmai,1638874743,Building Wealth By Taking Loans Against Your Crypto,[removed],https://www.reddit.com/r/CryptoCurrency/comments/rawmai/building_wealth_by_taking_loans_against_your/
rawmah,1638874743,New crypto by Stanford PhDs,[removed],https://www.reddit.com/r/CryptoCurrency/comments/rawmah/new_crypto_by_stanford_phds/
rawmag,1638874742,Suposed BTC creator win 54B in BTC,,https://www.reddit.com/r/CryptoCurrency/comments/rawmag/suposed_btc_creator_win_54b_in_btc/
rawm7u,1638874734,Need Suggestions for platforms/apps to invest in crypto currency,"I'm a newbie to investments and wanted to start investing a little in crypto on regular basis. I kinda don't have idea on platforms available for investing and trading, I'm searching online for suggestions too. It would be a good help if people just drop their suggestions for platforms to invest and trade. I kinda tried a few apps but they didn't have Indian currency for payments (I'm from India). So I'm kinda stuck.\nI'll consider anything and everything people suggest, like not just about the platforms but also about opinions and stuff. I've got good response in this sub while discussing about different topics, hoping it'll repeat the same.\nThank you",https://www.reddit.com/r/CryptoCurrency/comments/rawm7u/need_suggestions_for_platformsapps_to_invest_in/
rawm4s,1638874723,More than 25% of the US investors surveyed own Bitcoin,,https://www.reddit.com/r/CryptoCurrency/comments/rawm4s/more_than_25_of_the_us_investors_surveyed_own/
rawlv4,1638874693,"The government of Gibraltar is going to integrate Blockchain into government systems! — This is a good example of showing how blockchain technology can improve the speed, efficiency and transparency of government processes and public interactions.",,https://www.reddit.com/r/CryptoCurrency/comments/rawlv4/the_government_of_gibraltar_is_going_to_integrate/
rawl8l,1638874621,Tell me your best/worst crypto experiences,"I guess everyone who is in it longer period has made some mistakes before learning how to do it right. People who bought btc at 69k in May are still hitting their heads today. *Condolences for you.*\n\nFor example, I have a friend who I talked to crypto at the beginning of this year. No questions asked, he opened a binance account and deposited his first $ 500 from a savings account. After a little bit of  Binance, he discovered the Futures feature. He watched a few videos on YT and found that leverage trading is a very good idea and why everyone doesn't do it if it brings such income. Setting the highest possible gear, he bought BTC for long. I remember when I was bombed with messages why I didn't tell him about this feature. It turned out that his position was liquidated within 5 minutes and he lost everything. I have a bad feeling of guilt for persuading him to do crypto. Since then, I don't talk to anyone about crypto, except crypto communities . \n\n*PS: My friend is doing fine, he bounced off the bottom.*\n\nSo tell me anything, I'm curious.",https://www.reddit.com/r/CryptoCurrency/comments/rawl8l/tell_me_your_bestworst_crypto_experiences/
rawl7z,1638874619,"Polygon Partners With Earth2 (Do Not Delete, Crypto Related)",,https://www.reddit.com/r/CryptoCurrency/comments/rawl7z/polygon_partners_with_earth2_do_not_delete_crypto/
rawktf,1638874573,"BIS: DeFi poses risks, says ‘decentralization is an illusion’",,https://www.reddit.com/r/CryptoCurrency/comments/rawktf/bis_defi_poses_risks_says_decentralization_is_an/
rawkaw,1638874517,Pi Network Stanford crypto,[removed],https://www.reddit.com/r/CryptoCurrency/comments/rawkaw/pi_network_stanford_crypto/
rawjv0,1638874467,If anyone is in need for a Kucoin referral code/link. Here you go!,[removed],https://www.reddit.com/r/CryptoCurrency/comments/rawjv0/if_anyone_is_in_need_for_a_kucoin_referral/
rawj26,1638874378,Want to increase passive income come here,[removed],https://www.reddit.com/r/CryptoCurrency/comments/rawj26/want_to_increase_passive_income_come_here/
rawivc,1638874355,Kromatika Finance Logo Contest,[removed],https://www.reddit.com/r/CryptoCurrency/comments/rawivc/kromatika_finance_logo_contest/
rawi93,1638874285,Kromatika Logo Contest,[removed],https://www.reddit.com/r/CryptoCurrency/comments/rawi93/kromatika_logo_contest/
rawi3p,1638874271,"LP, Yield Farm, Research","I'm still new to both concepts. \n\nSeen some videos on LP (binance, impermanent loss, some random youtubers), but none of them teach you how to maximize / optimize profits.\n\nImpermanent loss is also difficult to grasp in perspective to potential gain.\nSeems to me that LP is only worth it if done with big capital, I hope this isn't true. It also does not have to be binance.\n\nAnother question; how would I go about researching which projects to pick for yield farming? how does this work? \n\nLastly, how do you do the proper research on projects? key metrics, tools, info etc.\n\nany tips or advice is appreciated!\n\nNOTE; Other suggestions for earning are welcome too.",https://www.reddit.com/r/CryptoCurrency/comments/rawi3p/lp_yield_farm_research/
rawhse,1638874234,"Natwest (UK Bank, subsidiary of Royal Bank of Scotland) now lists 'Investing in Cryptocurrency' as a legitimate payment reason along with Paying family and friends and buying online.",,https://www.reddit.com/r/CryptoCurrency/comments/rawhse/natwest_uk_bank_subsidiary_of_royal_bank_of/
rawhrs,1638874232,Crypto Market Cap Recovers $200B in a Day as Bitcoin Reclaims $50K (Market Watch),,https://www.reddit.com/r/CryptoCurrency/comments/rawhrs/crypto_market_cap_recovers_200b_in_a_day_as/
rawhd8,1638874186,I got a question guys. I bought Tether on accident and now i wanted to change it into BTC or ETH on my BRD Wallet. But every time i try it i get this message:,[removed],https://www.reddit.com/r/CryptoCurrency/comments/rawhd8/i_got_a_question_guys_i_bought_tether_on_accident/
rawfh2,1638873968,"No more checking crypto news, charts or portfolio until 2022","Hi! I got into crypto two months ago, and it has gone very well so far. Thanks for your help, Reddit! :)\n\nHowever, I'm getting more and more obsessed with crypto news, charts and my portfolio.\n\nIt was useful in the beginning, but at this point it's just a source of hopium, dopamine and FOMO.\n\nI'm already happy with my current status:\n\n1. Not investing more than I can afford to lose.\n2. BTC and ETH make up the majority of my portfolio.\n3. Investing in a few alts with high potential: LRC, CRO, ALGO, MATIC, SOL, DOT, and ADA. \[1\]\n4. Using a hardware wallet.\n5. Exchange login with Google Authenticator, and all web logins now use randomly generated passwords managed by BitWarden.\n\nIn 2022, this is my monthly plan:\n\n* 10% of paycheck into BTC/ETH. 5% evenly amongst the other coins.\n* 15% goes into an index fund.\n* Check portfolio and bank balances, and update spreadsheet.\n\nReddit and crypto news are limited to the weekends, just like alcohol or junk food.\n\nI will check out the [Polygon event thursday 9th](https://nitter.net/0xPolygon/status/1466479253935968259), but will refrain from checking anything crypto related for the rest of 2021 after that.\n\nHappy new year! :)\n\n\[1\]&lt;br /&gt; Yes, there are probably 50 other very promising projects out there (AAVE, SAND, AVAX, LUNA, ONE, LINK, ELROND, XMR, etc.), but I'm going nuts overthinking my portfolio allocation and second-guessing my decisions.",https://www.reddit.com/r/CryptoCurrency/comments/rawfh2/no_more_checking_crypto_news_charts_or_portfolio/
rawehi,1638873863,Gibraltar to Integrate Blockchain Into Government Systems,,https://www.reddit.com/r/CryptoCurrency/comments/rawehi/gibraltar_to_integrate_blockchain_into_government/
rawdn4,1638873764,Solana to $300 in a flash !,[removed],https://www.reddit.com/r/CryptoCurrency/comments/rawdn4/solana_to_300_in_a_flash/
rawdiy,1638873751,Polygon Partners With Earth2 Metaverse,,https://www.reddit.com/r/CryptoCurrency/comments/rawdiy/polygon_partners_with_earth2_metaverse/
rawd8k,1638873717,"Colombia’s Largest Bank Taps Gemini to Offer Bitcoin, Ethereum Trading to Clients - Decrypt",[removed],https://www.reddit.com/r/CryptoCurrency/comments/rawd8k/colombias_largest_bank_taps_gemini_to_offer/
rawd3f,1638873702,Govt considers giving cryptocurrency holders deadline to declare assets: Report,,https://www.reddit.com/r/CryptoCurrency/comments/rawd3f/govt_considers_giving_cryptocurrency_holders/
rawd0l,1638873693,Make Money with Free cryptocurrency,[removed],https://www.reddit.com/r/CryptoCurrency/comments/rawd0l/make_money_with_free_cryptocurrency/
rawcmx,1638873652,Stacks (STX) increase after the announcement of the network upgrade,,https://www.reddit.com/r/CryptoCurrency/comments/rawcmx/stacks_stx_increase_after_the_announcement_of_the/
rawcgy,1638873631,Trouble Locating an Exchange,"Good morning everyone!\n\nI'm having trouble finding/remembering the name of an exchange and what asset was offered.\n\nI recall checking the URL out in passing. IIRC it was some type of ""craigslist""-esque site in which verified crypto owners would send (I honestly can't recall the asset) it to wallets after they have been venmo'd, paypal'd, etc etc.\n\nThe website itself looked unremarkable, but it was a viable way to obtain whatever the asset was. If anyone knows wha I'm talking about and has the URL, I'd really appreciate it!\n\nSorry if my details aren't enough - like I said, I really only glanced over this site very quickly.  \nThanks and cheers!",https://www.reddit.com/r/CryptoCurrency/comments/rawcgy/trouble_locating_an_exchange/
rawcg5,1638873628,Dogecoin price dump reviewed using price action (zero indicators) Here is why Dogecoin has a secret pending pump with huge potentials,,https://www.reddit.com/r/CryptoCurrency/comments/rawcg5/dogecoin_price_dump_reviewed_using_price_action/
rawccq,1638873618,Huobi Research Report 'Taper Landed' Paints a Bleak Picture for Cryptocurrency Assets - Markets and Prices - Crypto News,,https://www.reddit.com/r/CryptoCurrency/comments/rawccq/huobi_research_report_taper_landed_paints_a_bleak/
rawbc8,1638873496,LTO UN Land Registry,"LTO just announced on twitter that there is about to be some news on the United Nations Land Registry project!\n\nThis project is what first got me so excited for LTO, but unfortunately the first project in Afghanistan had to be put on hold due to the Taliban taking over. \n\nLooks like land grab is back on the menu boys!! This should get us closer to that top 100! $1b MC here we come El Tio",https://www.reddit.com/r/CryptoCurrency/comments/rawbc8/lto_un_land_registry/
rawaa9,1638873374,"Serving Warm Meals, Hot Rewards, and Cold Storage with the Meals Token","Meals is a BEP-20 token with the goal of bringing purpose to the world of crypto trading.\n\nContrary to the mainstream narrative, cryptocurrencies have a lot more to offer than speculation about the newest flavor of pet-inspired memecoins.\n\nBlockchain is a revolutionary technology with the potential to make a lasting impact on society. Meals is a humble creator’s ambitious contribution towards turning that potential for good into the average consumer’s reality.\n\n\n\nFighting Child Hunger with the Meals Tax\n\nAs a BEP-20 token living on the Binance Smart Chain, Meals offers fast and secure transactions. Each of those transactions is subject to a 15% fee, aptly called the Meals Tax.\n\nThe biggest portion of the Meals Tax is funneled into a charity fund, one of the hallmark projects of the Meals token. The proceeds from this drive are donated to reputable social organizations.\n\nA meticulous vetting process is involved in the selection of the beneficiary organizations. Only parties with a proven track record for working tirelessly to feed underprivileged children can pass the selection process.\n\nThe goal of this vetting process is to ensure that every cent goes towards uplifting the lives of struggling communities that need help the most.\n\nAs a charitable token, one of the hallmark philosophies of Meals is to bring transparency into the process of charitable drives. The purpose-first token is achieving this by publishing irrefutable proof of donations through Twitter recognitions and website announcements with receipts.\n\nDespite being a young token with minimal marketing efforts so far, the Meals community has already contributed over $6,000 to organizations fighting against child hunger.\n\nThe vast majority of proceeds have gone to No Kid Hungry, a team of passionate volunteers dedicated to serving warm and healthy meals to young children across the United States.\n\n\n\nMaking Crypto Accessible with Copper Wallets\n\nBeing a strong believer in blockchain technology, the Meals community is thrilled to see the rising adoption rate of cryptocurrencies. The popular narrative on digital tokens is slowly but surely shifting from one of speculative assets to that of a financial revolution.\n\nDespite all that progress, there’s an undeniable void between cryptocurrency enthusiasts and everyday citizens, and that’s the technical know-how needed to get started.\n\nUnderstanding the purpose of blockchain technology is daunting for many people, whereas setting up a wallet, depositing funds and following cybersecurity best practices is a non-technical person’s nightmare.\n\nTo fill that void, Meals is laying a seamless bridge in the form of cold-storage physical-coin wallets. Made of .999 pure copper, these coins inject a dose of familiarity into an unfamiliar economy for the non-technical individual.\n\nHumans have used copper coins as a form of currency for ages. The psychological impact of holding one’s valuables in the palm of one’s hand is undeniable.\n\nMore importantly, these copper coins make the process of joining the cryptocurrency revolution hassle-free for every type of consumer. There’s no longer a need to set up a wallet, manageaddresses, and worry about the security of private keys.\n\nWith these cold-storage wallets, everything is a quick scan away thanks to distinctive, laser-etched QR codes. This unique setup is aimed at speeding up day-to-day transactions, securing long-term storage, and turning the entire process into a seamless experience.\n\n\n\nOffering a Digital Asset with Strong Fundamentals\n\nWhile uplifting struggling communities and nourishing children from marginalized backgrounds is the fundamental mission of this blockchain-for-good token, there are multiple built-in mechanisms to reward the investors powering this drive for change.\n\nOut of the 16% Meals Tax, 5% is used for auto-locking liquidity, thus ensuring a flawless trading experience for new entrants and lifelong holders alike.\n\nFurthermore, Meals is a reflection token, as 2% of all transactions are distributed proportionally among holders as a reward for their contributions.\n\nWith fundamentally sound tokenomics, a passionate community, and an unshakable resolve to use blockchain for good, Meals is designed to attract investors and social activists alike.\n\nDespite still being in its infancy, this wholesome token is already listed on popular data sites like CoinMarketCap and CoinGecko. The result of which includes thousands of U.S. dollars in charity donations and dividend distributions so far.\n\nThese early wins are a testament to the public’s demand for cryptocurrency trading with a purpose.\n\n\n\nFighting Against Child Hunger, One Transaction at a Time\n\nTaking up arms against child hunger is a wildly ambitious endeavor. But with the support of the wider blockchain community, the Meals family strongly believes that a meaningful impact is achievable.\n\nTo learn more about how to buy Meals and join the Meals community, visit https://mealsBSC.com",https://www.reddit.com/r/CryptoCurrency/comments/rawaa9/serving_warm_meals_hot_rewards_and_cold_storage/
raw9x7,1638873328,VCs eye investment in Polygon – TechCrunch,,https://www.reddit.com/r/CryptoCurrency/comments/raw9x7/vcs_eye_investment_in_polygon_techcrunch/
raw9kn,1638873286,"LUNA coin surges past DOGE, SHIB and AVAX to become 10th-largest coin",,https://www.reddit.com/r/CryptoCurrency/comments/raw9kn/luna_coin_surges_past_doge_shib_and_avax_to/
raw99j,1638873251,Can't believe r/CryptoCurrency has over 4 Million Subs - well done!,[removed],https://www.reddit.com/r/CryptoCurrency/comments/raw99j/cant_believe_rcryptocurrency_has_over_4_million/
raw8k9,1638873167,What would happen if people started withdrawing their Monero from exhanges? We already assume that less reputable exchanges like Binance use fractional reserve system like banks for Monero.,"Because there can be no proof that exchange is actually holding the XMR you buy, they could be selling fog to you instead of actual XMR and you have no way of knowing this until you actually withdraw XMR.\n\nThere has been some occasions when Binance delayed withdrawals in excuse of network problems.\n\nWhat I'm thinking is that they know there is a lot of investors, who hold their coins on exchanges (each has their own reason), so the exchanges don't need to have 100% funds that they say they have...\n\nI can think of many reasons why there could be mass transfer of crypto to personal wallets, like people start to withdraw, when there is a CEX hack, and they want to secure their funds..\n\nBut what would happen to XMR in case of mass withdrawal? would exchanges try to buy XMR at higher price to provide XMR for withdrawals and secure their reputation?\n\nWould they all say they have network issues? \n\nWould they delist it and try to leave investors with dust (that would create massive untrust to exchange who would do that, probably even lawsuits)?",https://www.reddit.com/r/CryptoCurrency/comments/raw8k9/what_would_happen_if_people_started_withdrawing/
raw6su,1638872969,Why do people still uses tether?,[removed],https://www.reddit.com/r/CryptoCurrency/comments/raw6su/why_do_people_still_uses_tether/
raw5lg,1638872826,Aussie crypto exchange in trouble,,https://www.reddit.com/r/CryptoCurrency/comments/raw5lg/aussie_crypto_exchange_in_trouble/
raw5az,1638872793,The famous smirk and finger bear flag (squid token),,https://www.reddit.com/r/CryptoCurrency/comments/raw5az/the_famous_smirk_and_finger_bear_flag_squid_token/
